[
  {
    "claim_category": "capital_expenditure",
    "value": 1400000000,
    "unit": "gbp",
    "geographic_scope": "Total project",
    "claimant": "Apatura (consultation website, citing unattributed 'independent economic analysis')",
    "methodology": "Not published",
    "independently_reviewed": null,
    "binding_status": "aspirational",
    "state": "developer_stated",
    "confidence": "low",
    "notes": "'£1.4 billion total investment'.",
    "source_ids": ["src-apatura-wh-benefits", "src-yahoo-ai-campus"]
  },
  {
    "claim_category": "other",
    "value": 125000000,
    "unit": "gbp",
    "geographic_scope": "Local supply chain (Edinburgh area)",
    "period": "Construction period",
    "claimant": "Apatura (consultation website)",
    "methodology": "Not published",
    "binding_status": "aspirational",
    "state": "developer_stated",
    "confidence": "low",
    "notes": "'£125 million of construction spend retained in the local supply chain' - a spend-retention claim, not jobs or GVA.",
    "source_ids": ["src-apatura-wh-benefits", "src-yahoo-ai-campus"]
  },
  {
    "claim_category": "gva",
    "value": 66000000,
    "unit": "gbp",
    "geographic_scope": "City of Edinburgh",
    "period": "Construction period",
    "claimant": "Apatura (consultation website)",
    "methodology": "Not published; attributed to unnamed 'independent economic analysis'",
    "binding_status": "modelled",
    "state": "developer_stated",
    "confidence": "low",
    "notes": "Construction-phase GVA to the City of Edinburgh area.",
    "source_ids": ["src-apatura-wh-benefits"]
  },
  {
    "claim_category": "gva",
    "value": 205000000,
    "unit": "gbp_per_year",
    "geographic_scope": "Local economy (Edinburgh)",
    "period": "Operational (annual)",
    "claimant": "Apatura (consultation website)",
    "methodology": "Not published; attributed to unnamed 'independent economic analysis'",
    "binding_status": "modelled",
    "state": "developer_stated",
    "confidence": "low",
    "notes": "'£205 million annually to local economy' (operational GVA).",
    "source_ids": ["src-apatura-wh-benefits"]
  },
  {
    "claim_category": "national_sector_claim",
    "value": 0.1,
    "unit": "other",
    "geographic_scope": "Scotland",
    "claimant": "Apatura (consultation website)",
    "binding_status": "modelled",
    "state": "developer_stated",
    "confidence": "low",
    "notes": "Claimed 0.1% uplift to Scotland's GDP (unit: percent of GDP).",
    "source_ids": ["src-apatura-wh-benefits"]
  },
  {
    "claim_category": "total_jobs_unspecified",
    "value": 245,
    "unit": "jobs",
    "geographic_scope": "Edinburgh",
    "claimant": "Apatura (as reported in press coverage of the consultation material)",
    "methodology": "Not published; category (construction vs operational, direct vs indirect, FTE) not stated",
    "binding_status": "aspirational",
    "state": "reported",
    "confidence": "low",
    "notes": "'245 jobs in Edinburgh' reported alongside the £1.4bn/£125m claims; the developer's own benefits page reviewed did not give job numbers, so this is recorded as unspecified-category and reported-state.",
    "source_ids": ["src-yahoo-ai-campus"]
  },
  {
    "claim_category": "apprenticeships",
    "value": 272000,
    "unit": "gbp_per_year",
    "geographic_scope": "Project",
    "claimant": "Apatura (consultation website)",
    "binding_status": "commitment_stated",
    "state": "developer_stated",
    "confidence": "low",
    "notes": "'Up to £272,000 annually' in apprenticeship levy - a levy payment figure, not a number of apprenticeships.",
    "source_ids": ["src-apatura-wh-benefits"]
  },
  {
    "claim_category": "other",
    "value": 23000000,
    "unit": "gbp",
    "geographic_scope": "UK/national",
    "claimant": "Apatura (consultation website)",
    "binding_status": "modelled",
    "state": "developer_stated",
    "confidence": "low",
    "notes": "'£23 million potential national R&D uplift'.",
    "source_ids": ["src-apatura-wh-benefits"]
  },
  {
    "claim_category": "community_benefit",
    "value": null,
    "unit": "unstated",
    "geographic_scope": "Local communities near the site",
    "claimant": "Apatura (consultation website)",
    "binding_status": "commitment_stated",
    "state": "developer_stated",
    "confidence": "low",
    "notes": "Proposal to work with the council and an independent delivery partner on community funds (play areas, youth/skills, wellbeing, green space, social enterprises); no fund value stated.",
    "source_ids": ["src-apatura-wh-benefits"]
  }
]
