[
  {
    "claim_category": "capital_expenditure",
    "value": 2000000000,
    "unit": "gbp",
    "geographic_scope": "Scotland",
    "claimant": "Sunlaws Development Company Limited",
    "binding_status": "aspirational",
    "state": "developer_stated",
    "confidence": "low",
    "notes": "Described variously as '£2 billion investment in the Scottish economy when the building is operational'; unclear whether this is construction capex, cumulative economic contribution, or asset value. No methodology published.",
    "source_ids": ["src-bt-southside-scoping", "src-itv-southside-campaign", "src-scotsman-southside-wind"]
  },
  {
    "claim_category": "direct_operational_jobs",
    "value": 100,
    "unit": "jobs",
    "geographic_scope": "Scottish Borders (local)",
    "claimant": "Sunlaws Development Company Limited",
    "binding_status": "unstated",
    "state": "developer_stated",
    "confidence": "low",
    "notes": "The headline '145 high-quality local jobs' is broken down by the developer as 100 direct and 45 indirect. FTE vs headcount unstated; no methodology published.",
    "source_ids": ["src-bt-southside-scoping"]
  },
  {
    "claim_category": "indirect_operational_jobs",
    "value": 45,
    "unit": "jobs",
    "geographic_scope": "Scottish Borders (local)",
    "claimant": "Sunlaws Development Company Limited",
    "binding_status": "unstated",
    "state": "developer_stated",
    "confidence": "low",
    "notes": "Indirect component of the 145 local jobs claim.",
    "source_ids": ["src-bt-southside-scoping"]
  },
  {
    "claim_category": "wider_regional_jobs",
    "value": 250,
    "unit": "jobs",
    "geographic_scope": "Scotland (outside the Borders)",
    "claimant": "Sunlaws Development Company Limited",
    "binding_status": "unstated",
    "state": "developer_stated",
    "confidence": "low",
    "notes": "'More than 250 jobs elsewhere in Scotland' — direct/indirect/induced split and methodology unstated; treated as a minimum ('over 250').",
    "source_ids": ["src-deadline-southside-consult", "src-midlothianview-campaign"]
  },
  {
    "claim_category": "peak_construction_workforce",
    "value": 1000,
    "unit": "jobs",
    "geographic_scope": "unstated",
    "period": "construction phase (c. 2029-2030)",
    "claimant": "Sunlaws Development Company Limited",
    "binding_status": "unstated",
    "state": "developer_stated",
    "confidence": "low",
    "notes": "'Around 1,000 jobs during the construction phase' — unclear whether peak workforce, total headcount or job-years; recorded as peak_construction_workforce as the most common reading, but the category is not stated by the claimant.",
    "source_ids": ["src-deadline-southside-consult", "src-bt-southside-scoping", "src-hellorayo-duke"]
  },
  {
    "claim_category": "annual_economic_output",
    "value": 25000000,
    "unit": "gbp_per_year",
    "geographic_scope": "Scotland",
    "claimant": "Sunlaws Development Company Limited",
    "binding_status": "modelled",
    "state": "developer_stated",
    "confidence": "low",
    "notes": "'£25 million annually to the Scottish economy' — whether GVA or gross output unstated.",
    "source_ids": ["src-midlothianview-campaign"]
  },
  {
    "claim_category": "annual_economic_output",
    "value": 12000000,
    "unit": "gbp_per_year",
    "geographic_scope": "Scottish Borders",
    "claimant": "Sunlaws Development Company Limited",
    "binding_status": "modelled",
    "state": "developer_stated",
    "confidence": "low",
    "notes": "'Around £12 million each year for the Borders' — subset of the £25m Scotland figure; measure (GVA vs output) unstated.",
    "source_ids": ["src-itv-southside-campaign", "src-midlothianview-campaign", "src-bt-residents-fight"]
  },
  {
    "claim_category": "gva",
    "value": 47000000,
    "unit": "gbp",
    "geographic_scope": "Scottish Borders",
    "period": "first 15 years of operation",
    "claimant": "Sunlaws Development Company Limited (citing a preliminary economic study)",
    "methodology": "Described only as a 'preliminary economic study'; author, model and assumptions not published",
    "independently_reviewed": null,
    "binding_status": "modelled",
    "state": "developer_stated",
    "confidence": "low",
    "notes": "'£47 million additional value to the Scottish Borders over the first 15 years' — recorded as GVA on the 'additional value' wording, but the measure is not explicitly defined.",
    "source_ids": ["src-bt-southside-scoping"]
  },
  {
    "claim_category": "business_rates",
    "value": 776000000,
    "unit": "gbp",
    "geographic_scope": "unstated (reported as tax revenue)",
    "period": "15 years",
    "claimant": "Sunlaws Development Company Limited (as reported by Border Telegraph)",
    "binding_status": "modelled",
    "state": "reported",
    "confidence": "low",
    "notes": "'£776 million tax revenue over 15 years' — reported once; the tax base (non-domestic rates vs all taxes) is unstated, so the business_rates category is an approximation. Sits awkwardly against the £25m/yr economic-contribution figure and needs verification against the source study.",
    "source_ids": ["src-bt-residents-fight"]
  }
]
