[
  {
    "claim_category": "capital_expenditure",
    "value": 2100000000,
    "unit": "gbp",
    "geographic_scope": "project",
    "claimant": "Apatura",
    "methodology": "Consultation panels state 'independent economic analysis' by an unnamed consultant; methodology not published.",
    "independently_reviewed": null,
    "binding_status": "aspirational",
    "state": "developer_stated",
    "confidence": "low",
    "notes": "£2.1bn 'total capital investment'.",
    "source_ids": ["src-apatura-westerhill-panels"]
  },
  {
    "claim_category": "total_jobs_unspecified",
    "value": 2157,
    "unit": "jobs",
    "geographic_scope": "East Dunbartonshire / wider economy (not clearly stated)",
    "period": "annual, during construction",
    "claimant": "Apatura",
    "methodology": "Panels say figures 'include direct and indirect jobs through local suppliers, service providers, and wider economic activity'; direct/indirect split not given, FTE basis unstated.",
    "independently_reviewed": null,
    "binding_status": "modelled",
    "state": "developer_stated",
    "confidence": "low",
    "notes": "'2,157 annual jobs created during construction'. Combined direct+indirect construction claim; cannot be classified as direct-only.",
    "source_ids": ["src-apatura-westerhill-panels"]
  },
  {
    "claim_category": "total_jobs_unspecified",
    "value": 1730,
    "unit": "jobs",
    "geographic_scope": "East Dunbartonshire / wider economy (not clearly stated)",
    "period": "annual, once operational",
    "claimant": "Apatura",
    "methodology": "Same unnamed 'independent economic analysis'; direct/indirect split not given.",
    "independently_reviewed": null,
    "binding_status": "modelled",
    "state": "developer_stated",
    "confidence": "low",
    "notes": "'1,730 ongoing annual jobs supported each year once operational' — combined direct and indirect; far exceeds typical direct operational staffing of a 300MW campus, so predominantly indirect/induced.",
    "source_ids": ["src-apatura-westerhill-panels"]
  },
  {
    "claim_category": "gva",
    "value": 642000000,
    "unit": "gbp",
    "geographic_scope": "East Dunbartonshire",
    "period": "during construction",
    "claimant": "Apatura",
    "binding_status": "modelled",
    "state": "developer_stated",
    "confidence": "low",
    "notes": "'£642m GVA added to the East Dunbartonshire economy during construction'.",
    "source_ids": ["src-apatura-westerhill-panels"]
  },
  {
    "claim_category": "annual_economic_output",
    "value": 420000000,
    "unit": "gbp_per_year",
    "geographic_scope": "local economy (unspecified)",
    "period": "once operational",
    "claimant": "Apatura",
    "binding_status": "modelled",
    "state": "developer_stated",
    "confidence": "low",
    "notes": "'£420m added to the local economy every year once operational'; measure (GVA vs output) unstated.",
    "source_ids": ["src-apatura-westerhill-panels"]
  },
  {
    "claim_category": "other",
    "value": 91200000,
    "unit": "gbp",
    "geographic_scope": "East Dunbartonshire",
    "period": "construction",
    "claimant": "Apatura",
    "binding_status": "modelled",
    "state": "developer_stated",
    "confidence": "low",
    "notes": "'£91.2m in construction spend retained in East Dunbartonshire'.",
    "source_ids": ["src-apatura-westerhill-panels"]
  },
  {
    "claim_category": "community_benefit",
    "value": null,
    "unit": "unstated",
    "claimant": "Apatura",
    "binding_status": "commitment_stated",
    "state": "developer_stated",
    "confidence": "low",
    "notes": "Developer states support for council-coordinated community benefit funding via Section 75 agreements and proposes working with a delivery partner such as Foundation Scotland; no amounts stated and nothing yet secured.",
    "source_ids": ["src-apatura-westerhill-panels"]
  }
]
