[
  {
    "claim_category": "capital_expenditure",
    "value": 15000000000,
    "unit": "gbp",
    "geographic_scope": "All three Stoics sites (Cato, Rufus, Aurelius) combined — not Aurelius alone",
    "claimant": "ILI Group",
    "methodology": "Not published",
    "independently_reviewed": false,
    "binding_status": "aspirational",
    "state": "developer_stated",
    "confidence": "low",
    "notes": "£15 billion 'investment' claimed at the Stoics launch (4 Nov 2025) and repeated in later trade press. No per-site breakdown for Aurelius has been published.",
    "source_ids": ["src-bdc-stoics-2025", "src-dcr-submission"]
  },
  {
    "claim_category": "peak_construction_workforce",
    "value": null,
    "unit": "jobs",
    "geographic_scope": "All three Stoics sites combined",
    "period": "construction",
    "claimant": "ILI Group",
    "methodology": "Not published",
    "binding_status": "aspirational",
    "state": "developer_stated",
    "confidence": "low",
    "notes": "'Thousands of construction jobs at peak' claimed across the Stoics network; no number, no direct/indirect split, no jobs-vs-job-years definition, no per-site figure for Aurelius.",
    "source_ids": ["src-ili-data-centres", "src-bdc-stoics-2025"]
  },
  {
    "claim_category": "direct_operational_jobs",
    "value": null,
    "unit": "unstated",
    "geographic_scope": "All three Stoics sites combined",
    "period": "operation",
    "claimant": "ILI Group",
    "methodology": "Not published",
    "binding_status": "aspirational",
    "state": "not_disclosed",
    "confidence": "low",
    "notes": "'Long-term, high-value roles in operations and technology' claimed at network level; no number and no categorisation. No Aurelius-specific operational jobs figure located.",
    "source_ids": ["src-ili-data-centres"]
  }
]
