[
  {
    "claim_category": "capital_expenditure",
    "value": 5000000000,
    "unit": "gbp",
    "geographic_scope": "Cato project (Fife)",
    "claimant": "ILI Group",
    "binding_status": "aspirational",
    "state": "developer_stated",
    "confidence": "medium",
    "notes": "£5bn headline investment for Cato; the full three-site Stoics network is claimed at £15bn.",
    "source_ids": ["src-dcr-submission", "src-dcr-objections"]
  },
  {
    "claim_category": "construction_job_years",
    "value": 9660,
    "unit": "job_years",
    "geographic_scope": "Scotland",
    "period": "construction (phased from 2027)",
    "claimant": "ILI Group",
    "consultant": "BiGGAR Economics",
    "methodology": "Economic impact assessment by BiGGAR Economics; method not published in secondary sources",
    "independently_reviewed": null,
    "binding_status": "modelled",
    "state": "developer_stated",
    "confidence": "medium",
    "source_ids": ["src-dcr-submission"]
  },
  {
    "claim_category": "construction_job_years",
    "value": 1450,
    "unit": "job_years",
    "geographic_scope": "Fife",
    "period": "construction",
    "claimant": "ILI Group",
    "consultant": "BiGGAR Economics",
    "binding_status": "modelled",
    "state": "developer_stated",
    "confidence": "medium",
    "source_ids": ["src-dcr-submission"]
  },
  {
    "claim_category": "gva",
    "value": 708000000,
    "unit": "gbp",
    "geographic_scope": "Scotland",
    "period": "construction",
    "claimant": "ILI Group",
    "consultant": "BiGGAR Economics",
    "binding_status": "modelled",
    "state": "developer_stated",
    "confidence": "medium",
    "notes": "£708m GVA across Scotland during construction, of which £105m in Fife (recorded separately).",
    "source_ids": ["src-dcr-submission", "src-dcr-objections"]
  },
  {
    "claim_category": "gva",
    "value": 105000000,
    "unit": "gbp",
    "geographic_scope": "Fife",
    "period": "construction",
    "claimant": "ILI Group",
    "consultant": "BiGGAR Economics",
    "binding_status": "modelled",
    "state": "developer_stated",
    "confidence": "medium",
    "source_ids": ["src-dcr-submission", "src-dcr-objections"]
  },
  {
    "claim_category": "direct_operational_jobs",
    "value": 120,
    "unit": "jobs",
    "geographic_scope": "on-site (Fife)",
    "period": "operational",
    "claimant": "ILI Group",
    "binding_status": "aspirational",
    "state": "developer_stated",
    "confidence": "medium",
    "notes": "'Approximately 120 permanent skilled roles' on site. Conflicts with the 30-50 permanent jobs figure the developer gave the community council in Nov 2025 (recorded separately).",
    "source_ids": ["src-dcr-submission", "src-dcr-objections"]
  },
  {
    "claim_category": "total_jobs_unspecified",
    "value": 540,
    "unit": "jobs",
    "geographic_scope": "Scotland",
    "period": "operational",
    "claimant": "ILI Group",
    "consultant": "BiGGAR Economics",
    "binding_status": "modelled",
    "state": "developer_stated",
    "confidence": "medium",
    "notes": "540 operational jobs across Scotland (262 in Fife); split between direct/indirect/induced not published in secondary sources — likely includes multiplier effects beyond the 120 on-site roles.",
    "source_ids": ["src-dcr-submission"]
  },
  {
    "claim_category": "total_jobs_unspecified",
    "value": 262,
    "unit": "jobs",
    "geographic_scope": "Fife",
    "period": "operational",
    "claimant": "ILI Group",
    "consultant": "BiGGAR Economics",
    "binding_status": "modelled",
    "state": "developer_stated",
    "confidence": "medium",
    "source_ids": ["src-dcr-submission"]
  },
  {
    "claim_category": "direct_operational_jobs",
    "value": null,
    "value_min": 30,
    "value_max": 50,
    "unit": "jobs",
    "geographic_scope": "on-site",
    "period": "operational",
    "claimant": "ILI Group (statement to Auchtertool Community Council, Nov 2025)",
    "binding_status": "aspirational",
    "state": "superseded",
    "confidence": "low",
    "notes": "Pre-application figure of 30-50 permanent jobs post-completion, later superseded by the application-stage claim of ~120 permanent skilled roles.",
    "source_ids": ["src-acc-village-update"]
  },
  {
    "claim_category": "peak_construction_workforce",
    "value": 1000,
    "unit": "jobs",
    "geographic_scope": "on-site",
    "period": "construction",
    "claimant": "ILI Group (statement to Auchtertool Community Council, Nov 2025)",
    "binding_status": "aspirational",
    "state": "developer_stated",
    "confidence": "low",
    "notes": "'Up to 1,000 jobs during construction phase' — pre-application figure; treat as an upper bound on peak workforce rather than job-years.",
    "source_ids": ["src-acc-village-update"]
  },
  {
    "claim_category": "apprenticeships",
    "value": null,
    "unit": "unstated",
    "claimant": "ILI Group (statement to Auchtertool Community Council, Nov 2025)",
    "binding_status": "aspirational",
    "state": "developer_stated",
    "confidence": "low",
    "notes": "Potential local apprenticeships mentioned; no number given.",
    "source_ids": ["src-acc-village-update"]
  }
]
