[
  {
    "claim_category": "peak_construction_workforce",
    "value": 1000,
    "unit": "jobs",
    "geographic_scope": "North East Scotland",
    "period": "construction",
    "claimant": "Ashfield Land / TechRE press release (2026-04-22)",
    "methodology": "Not stated; 'around 1,000 construction jobs' at full scale — whether peak headcount, average or job-years is unstated",
    "independently_reviewed": false,
    "binding_status": "aspirational",
    "state": "developer_stated",
    "confidence": "low",
    "notes": "Category assigned as peak/around figure for construction; press release does not distinguish direct vs indirect or FTE vs headcount. Conditional on full-scale delivery.",
    "source_ids": ["src-aprs-blackdog", "src-digit-600mw", "src-abn-blackdog"]
  },
  {
    "claim_category": "direct_operational_jobs",
    "value": 100,
    "unit": "jobs",
    "geographic_scope": "North East Scotland",
    "period": "operational",
    "claimant": "Ashfield Land / TechRE press release (2026-04-22)",
    "methodology": "Not stated; 'around 100 highly skilled permanent roles'",
    "independently_reviewed": false,
    "binding_status": "aspirational",
    "state": "developer_stated",
    "confidence": "low",
    "notes": "The only permanent direct employment figure — two orders of magnitude below the combined construction/indirect headlines. FTE status unstated; appears to relate to the campus at scale.",
    "source_ids": ["src-aprs-blackdog", "src-digit-600mw", "src-abn-blackdog"]
  },
  {
    "claim_category": "indirect_operational_jobs",
    "value": null,
    "value_max": 2000,
    "unit": "jobs",
    "geographic_scope": "Region ('across engineering, digital services and R&D')",
    "period": "unstated",
    "claimant": "Ashfield Land / TechRE press release (2026-04-22)",
    "methodology": "Not stated; 'up to 2,000 indirect jobs' — no multiplier methodology or consultant named",
    "independently_reviewed": false,
    "binding_status": "aspirational",
    "state": "developer_stated",
    "confidence": "low",
    "notes": "'Up to' figure, contingent on full-scale delivery; no distinction between indirect and induced.",
    "source_ids": ["src-aprs-blackdog", "src-digit-600mw", "src-abn-blackdog"]
  },
  {
    "claim_category": "capital_expenditure",
    "value": null,
    "value_min": 10000000000,
    "unit": "gbp",
    "geographic_scope": "Site",
    "period": "per gigawatt of data centre capacity",
    "claimant": "Ashfield Land / TechRE press release (2026-04-22)",
    "methodology": "Rule of thumb: 'a single gigawatt of data centre capacity requiring over £10 billion pounds to develop'; 'billions of pounds in private investment' at full scale",
    "independently_reviewed": false,
    "binding_status": "aspirational",
    "state": "developer_stated",
    "confidence": "low",
    "source_ids": ["src-aprs-blackdog", "src-abn-blackdog"]
  },
  {
    "claim_category": "other",
    "value": 1500,
    "unit": "jobs",
    "geographic_scope": "North East Scotland",
    "period": "long term, once mixed-use development complete",
    "claimant": "Ashfield Land / Kirkwood Homes (2016, for the consented mixed-use scheme, NOT the data centre)",
    "methodology": "Developer statement for the 2016 £150m mixed-use application: 1,200 construction jobs and 1,500 net additional full-time jobs long term, £586m salaries over 25 years, £1.56bn GVA",
    "independently_reviewed": false,
    "binding_status": "aspirational",
    "state": "superseded",
    "confidence": "low",
    "notes": "Recorded for context of the consent the data centre relies on. These figures relate to the town centre/housing scheme, not the data centre, and are superseded by the 2026 data centre claims for this site's future.",
    "source_ids": ["src-ashfield-2016-application", "src-energetica-blackdog"]
  }
]
