[
  {
    "claim_category": "total_jobs_unspecified",
    "value": 3400,
    "unit": "jobs",
    "geographic_scope": "Lanarkshire AI Growth Zone (ZONE-LEVEL, all sites — not DV4 alone)",
    "period": "over the coming years",
    "claimant": "UK Government (DSIT) / DataVita",
    "methodology": "Not published; press-release figure spanning construction, data centre operations, renewable energy and AI-related roles",
    "independently_reviewed": false,
    "binding_status": "aspirational",
    "state": "reported",
    "confidence": "low",
    "notes": "Roughly 800 described as 'high-value AI roles' with the remainder construction/infrastructure. APRS FoI analysis claims more than 90% of these are construction, indirect or induced jobs, and that induced jobs need not be in Lanarkshire or Scotland.",
    "source_ids": ["src-govuk-lanarkshire-aigz-2026", "src-datavita-aigz-faq", "src-aprs-chapelhall-aigz"]
  },
  {
    "claim_category": "direct_operational_jobs",
    "value": 800,
    "unit": "jobs",
    "geographic_scope": "Lanarkshire AI Growth Zone (ZONE-LEVEL)",
    "claimant": "UK Government (DSIT)",
    "methodology": "Described as 'around 800 high-value AI roles — researchers, coders and data centre staff'; category mixes operational data-centre staff with wider AI roles, so treated as an approximation of direct operational/AI employment",
    "binding_status": "aspirational",
    "state": "reported",
    "confidence": "low",
    "source_ids": ["src-govuk-lanarkshire-aigz-2026"]
  },
  {
    "claim_category": "total_jobs_unspecified",
    "value": null,
    "unit": "jobs",
    "geographic_scope": "Lanarkshire AI Growth Zone",
    "claimant": "APRS (based on UK Government FoI response)",
    "methodology": "FoI response on the composition of the 3,400 figure; APRS states >90% are construction, indirect or induced, and a Parliamentary Question established induced jobs could arise anywhere in the UK",
    "binding_status": "unstated",
    "state": "disputed",
    "confidence": "medium",
    "notes": "Counter-claim disputing the headline zone jobs figure; underlying FoI documents not independently inspected.",
    "source_ids": ["src-aprs-chapelhall-aigz"]
  },
  {
    "claim_category": "apprenticeships",
    "value": 50,
    "unit": "jobs",
    "geographic_scope": "Lanarkshire AI Growth Zone (ZONE-LEVEL)",
    "claimant": "UK Government (DSIT)",
    "binding_status": "commitment_stated",
    "state": "reported",
    "confidence": "low",
    "source_ids": ["src-govuk-lanarkshire-aigz-2026"]
  },
  {
    "claim_category": "capital_expenditure",
    "value": 8200000000,
    "unit": "gbp",
    "geographic_scope": "Lanarkshire AI Growth Zone (ZONE-LEVEL private investment)",
    "claimant": "UK Government (DSIT) / DataVita",
    "binding_status": "aspirational",
    "state": "reported",
    "confidence": "low",
    "notes": "£8.2bn total private investment claim for the zone; includes CoreWeave's £1.5bn commitment. No breakdown by site published.",
    "source_ids": ["src-govuk-lanarkshire-aigz-2026", "src-datavita-aigz-faq", "src-scn-aigz-2026"]
  },
  {
    "claim_category": "capital_expenditure",
    "value": 1500000000,
    "unit": "gbp",
    "geographic_scope": "UK (CoreWeave commitment centred on DataVita's Lanarkshire campus)",
    "claimant": "CoreWeave",
    "binding_status": "commitment_stated",
    "state": "developer_stated",
    "confidence": "medium",
    "notes": "September 2025 investor announcement of a £1.5bn UK commitment including NVIDIA Grace Blackwell Ultra deployment at DataVita's Lanarkshire campus; an announced commitment, not a disclosed contract.",
    "source_ids": ["src-coreweave-uk-15bn-2025"]
  },
  {
    "claim_category": "community_benefit",
    "value": 543000000,
    "unit": "gbp",
    "geographic_scope": "Lanarkshire AI Growth Zone communities",
    "period": "15 years at full operation (£36m+/year per developer FAQ)",
    "claimant": "UK Government (DSIT) / DataVita",
    "binding_status": "commitment_stated",
    "state": "reported",
    "confidence": "low",
    "notes": "Community Investment Fund of up to £543m; no legal mechanism (e.g. s75) published. HFD Group separately pledges £1m/year to local charities.",
    "source_ids": ["src-govuk-lanarkshire-aigz-2026", "src-datavita-aigz-faq"]
  },
  {
    "claim_category": "other",
    "value": 900000000,
    "unit": "gbp",
    "geographic_scope": "Local salaries, Lanarkshire AI Growth Zone",
    "period": "first five years of operation",
    "claimant": "DataVita (AI Growth Zone FAQ)",
    "methodology": "Not published",
    "binding_status": "aspirational",
    "state": "developer_stated",
    "confidence": "low",
    "notes": "'Local salaries projected to exceed £900m over first five years of operation'.",
    "source_ids": ["src-datavita-aigz-faq"]
  }
]
