[
  {
    "claim_category": "capital_expenditure",
    "value": 1700000000,
    "unit": "gbp",
    "geographic_scope": "Project",
    "claimant": "Apatura",
    "methodology": "Not published",
    "binding_status": "aspirational",
    "state": "developer_stated",
    "confidence": "low",
    "notes": "'£1.7 billion total investment' on the consultation benefits page.",
    "source_ids": ["src-apatura-freeport-benefits"]
  },
  {
    "claim_category": "gva",
    "value": 137000000,
    "unit": "gbp",
    "geographic_scope": "West Lothian",
    "period": "construction phase (total)",
    "claimant": "Apatura",
    "methodology": "Not published",
    "binding_status": "modelled",
    "state": "developer_stated",
    "confidence": "low",
    "notes": "Construction-phase GVA to the West Lothian area; direct/indirect/induced split not stated.",
    "source_ids": ["src-apatura-freeport-benefits"]
  },
  {
    "claim_category": "gva",
    "value": 257000000,
    "unit": "gbp_per_year",
    "geographic_scope": "Local economy (West Lothian)",
    "period": "operational",
    "claimant": "Apatura",
    "methodology": "Not published",
    "binding_status": "modelled",
    "state": "developer_stated",
    "confidence": "low",
    "notes": "'£257 million added to local economy annually' when operational; direct/indirect/induced split not stated.",
    "source_ids": ["src-apatura-freeport-benefits"]
  },
  {
    "claim_category": "other",
    "value": 275000000,
    "unit": "gbp",
    "geographic_scope": "Local supply chain",
    "period": "construction phase",
    "claimant": "Apatura",
    "methodology": "Not published",
    "binding_status": "aspirational",
    "state": "developer_stated",
    "confidence": "low",
    "notes": "'£275 million local construction spend retained in local supply chain' - a spend-retention claim, not GVA or jobs.",
    "source_ids": ["src-apatura-freeport-benefits"]
  },
  {
    "claim_category": "apprenticeships",
    "value": 350000,
    "unit": "gbp_per_year",
    "geographic_scope": "Project",
    "claimant": "Apatura",
    "methodology": "Not published",
    "binding_status": "aspirational",
    "state": "developer_stated",
    "confidence": "low",
    "notes": "'Up to £350,000 annually' apprenticeship levy contribution (a levy figure, not apprenticeship places).",
    "source_ids": ["src-apatura-freeport-benefits"]
  },
  {
    "claim_category": "national_sector_claim",
    "value": null,
    "unit": "other",
    "geographic_scope": "Scotland",
    "claimant": "Apatura",
    "methodology": "Not published",
    "binding_status": "aspirational",
    "state": "developer_stated",
    "confidence": "low",
    "notes": "Claims of a '0.2% projected increase' in Scotland's GDP and '£28.9 million potential national R&D uplift'. Methodology unstated; recorded as national sector claims, not project-level outputs.",
    "source_ids": ["src-apatura-freeport-benefits"]
  },
  {
    "claim_category": "community_benefit",
    "value": null,
    "unit": "unstated",
    "geographic_scope": "West Calder area",
    "claimant": "Apatura",
    "binding_status": "commitment_stated",
    "state": "developer_stated",
    "confidence": "low",
    "notes": "Section 75 community benefits approach described (playgrounds, youth programmes, mental health, environment, sport), with Foundation Scotland suggested as fund manager; no fund value stated. No job numbers (construction or operational) are quantified anywhere in the located material.",
    "source_ids": ["src-apatura-freeport-benefits"]
  }
]
