[
  {
    "claim_category": "capital_expenditure",
    "value": 3900000000,
    "unit": "gbp",
    "geographic_scope": "Project",
    "claimant": "Apatura",
    "binding_status": "aspirational",
    "state": "developer_stated",
    "confidence": "medium",
    "notes": "£3.9bn 'estimated construction cost' per the June 2025 announcement; rounded to '£4 billion' in some press coverage.",
    "source_ids": ["src-apatura-news-ravenscraig", "src-dcd-apatura-ravenscraig"]
  },
  {
    "claim_category": "gva",
    "value": 1200000000,
    "unit": "gbp",
    "geographic_scope": "Scotland",
    "period": "construction (one-off)",
    "claimant": "Apatura, citing an unnamed 'independent socio-economic study'",
    "methodology": "Not disclosed; consultant unnamed",
    "independently_reviewed": null,
    "binding_status": "modelled",
    "state": "developer_stated",
    "confidence": "low",
    "notes": "June 2025 announcement figure. Apparently revised down to £766m by October 2025 (separate entry).",
    "source_ids": ["src-apatura-news-ravenscraig"]
  },
  {
    "claim_category": "construction_job_years",
    "value": 16000,
    "unit": "job_years",
    "geographic_scope": "Scotland",
    "period": "construction",
    "claimant": "Apatura, citing an unnamed 'independent socio-economic study'",
    "methodology": "Not disclosed",
    "binding_status": "modelled",
    "state": "developer_stated",
    "confidence": "low",
    "notes": "'16,000+ job years across Scotland' — job-years, not jobs.",
    "source_ids": ["src-apatura-news-ravenscraig"]
  },
  {
    "claim_category": "gva",
    "value": 729000000,
    "unit": "gbp_per_year",
    "geographic_scope": "Scotland",
    "period": "operational (annual)",
    "claimant": "Apatura, citing an unnamed 'independent socio-economic study'",
    "methodology": "Not disclosed",
    "binding_status": "modelled",
    "state": "developer_stated",
    "confidence": "low",
    "notes": "June 2025 figure; October 2025 coverage cites £583m annual GVA instead (separate entry). Also expressed as +0.4% of Scotland's annual GDP.",
    "source_ids": ["src-apatura-news-ravenscraig"]
  },
  {
    "claim_category": "total_jobs_unspecified",
    "value": 2399,
    "unit": "jobs",
    "geographic_scope": "Scotland",
    "period": "operational (long-term)",
    "claimant": "Apatura, citing an unnamed 'independent socio-economic study'",
    "methodology": "Stated to combine direct, indirect and induced jobs; split not disclosed",
    "binding_status": "modelled",
    "state": "developer_stated",
    "confidence": "low",
    "notes": "June 2025 figure ('2,399 long-term jobs — direct, indirect and induced'); press rounds to 'more than 2,300 jobs'. Classified as unspecified because the direct/indirect/induced split is not published.",
    "source_ids": ["src-apatura-news-ravenscraig"]
  },
  {
    "claim_category": "gva",
    "value": 766000000,
    "unit": "gbp",
    "geographic_scope": "Scotland",
    "period": "construction (one-off)",
    "claimant": "Apatura (reported)",
    "binding_status": "modelled",
    "state": "reported",
    "confidence": "low",
    "notes": "October 2025 consultation-stage figure of £766m construction GVA, lower than the £1.2bn claimed in June 2025; no explanation for the revision located.",
    "source_ids": ["src-scn-consultation"]
  },
  {
    "claim_category": "gva",
    "value": 583000000,
    "unit": "gbp_per_year",
    "geographic_scope": "Scotland",
    "period": "operational (annual)",
    "claimant": "Apatura (reported)",
    "binding_status": "modelled",
    "state": "reported",
    "confidence": "low",
    "notes": "October 2025 figure of £583m annual GVA, lower than the £729m claimed in June 2025.",
    "source_ids": ["src-scn-consultation"]
  },
  {
    "claim_category": "total_jobs_unspecified",
    "value": 2000,
    "unit": "jobs",
    "geographic_scope": "Not stated",
    "period": "operational",
    "claimant": "Apatura (reported)",
    "binding_status": "modelled",
    "state": "reported",
    "confidence": "low",
    "notes": "October 2025 coverage cites 'over 2,000 jobs', vs 2,399 in June 2025. Category split not disclosed.",
    "source_ids": ["src-scn-consultation"]
  },
  {
    "claim_category": "direct_operational_jobs",
    "value": 1044,
    "unit": "jobs",
    "geographic_scope": "Not stated",
    "period": "operational (permanent)",
    "claimant": "Bylines Network (critical reporting)",
    "binding_status": "unstated",
    "state": "reported",
    "confidence": "low",
    "notes": "Bylines states 'only 1,044 permanent jobs proposed — a lean return for a project of this scale'. Provenance (possibly PAN documentation) unverified; conflicts with developer totals which include indirect/induced jobs.",
    "source_ids": ["src-bylines-hyperscale"]
  },
  {
    "claim_category": "other",
    "value": 0.4,
    "unit": "other",
    "geographic_scope": "Scotland",
    "period": "operational (annual)",
    "claimant": "Apatura, citing an unnamed 'independent socio-economic study'",
    "methodology": "Not disclosed",
    "binding_status": "modelled",
    "state": "developer_stated",
    "confidence": "low",
    "notes": "Claim that the campus would add 0.4% to Scotland's annual GDP once operational (value is percent).",
    "source_ids": ["src-apatura-news-ravenscraig"]
  }
]
